{
    "name": "SimpleExample",
    "components": [
        {
            "id": "Resistor_0",
            "type": "Resistor",
            "parameters": {
                "R": 10.0
            }
        },
        {
            "id": "Solver_0",
            "type": "Solver",
            "parameters": {}
        },
        {
            "id": "Reference_0",
            "type": "Reference",
            "parameters": {}
        }
    ],
    "subsystems": [
        {
            "id": "VoltageSource_0",
            "components": [
                {
                    "id": "VoltageSourceDC_0",
                    "type": "VoltageSourceDC",
                    "parameters": {
                        "dc_voltage": 10.0
                    }
                },
                {
                    "id": "ConnectionPort_0",
                    "type": "ConnectionPort",
                    "parameters": {
                        "Orientation": "left",
                        "Side": "left",
                        "_Port_Type": "Inport"
                    }
                },
                {
                    "id": "ConnectionPort_1",
                    "type": "ConnectionPort",
                    "parameters": {
                        "Orientation": "right",
                        "Side": "right",
                        "_Port_Type": "Outport"
                    }
                }
            ],
            "connections": [
                {
                    "from": "VoltageSourceDC_0#LConn 1",
                    "to": "ConnectionPort_0#RConn 1"
                },
                {
                    "from": "VoltageSourceDC_0#RConn 1",
                    "to": "ConnectionPort_1#RConn 1"
                }
            ]
        }
    ],
    "connections": [
        {
            "from": "VoltageSource_0#ConnectionPort_0",
            "to": "Resistor_0#LConn 1"
        },
        {
            "from": "VoltageSource_0#ConnectionPort_1",
            "to": "Resistor_0#RConn 1"
        },
        {
            "from": "VoltageSource_0#ConnectionPort_0",
            "to": "Reference_0#LConn 1"
        },
        {
            "from": "VoltageSource_0#ConnectionPort_0",
            "to": "Solver_0#RConn 1"
        }
    ],
    "parameters": {
        "Solver": "ode23t",
        "StopTime": 100
    }
}